{
  "presentation": {
    "title": "Arizona Rule of Law Ambassador Presentation",
    "scenes": [
      {
        "scene_id": "scene_56e44065a564",
        "slug": "opening",
        "title": "Opening",
        "kicker": "Arizona Rule of Law Ambassador Program",
        "display_lines": [
          "Defending the Rule of Law",
          "Arizona's civic commitment"
        ],
        "speaker_notes": "Welcome the audience and frame the session as a civic conversation, not a political debate. Explain that the presentation will define the Rule of Law, show why it matters in daily public life, and offer practical ways to discuss it constructively in Arizona communities.",
        "duration_tags": [
          20,
          45,
          60
        ],
        "audience_mode": "public",
        "visual_treatment": "Full-bleed Arizona desert horizon with restrained civic typography and a red-gold sun mark.",
        "speaker_only_blocks": [
          {
            "title": "Facilitation Cue",
            "body": "What does fairness or predictability look like in your daily life?"
          },
          {
            "title": "Likely Audience Question",
            "body": "How does this principle apply in everyday civic life?"
          },
          {
            "title": "Transition",
            "body": "Let's start by defining the Rule of Law in plain English."
          }
        ],
        "resource_refs": [],
        "source_support": [
          "manual_8bfee944f39f"
        ],
        "generated_scaffolding": [
          "Scene framing and visual treatment were generated from manual and field guide content for web presentation use.",
          "Display-language compression was generated to fit the scene-based presentation format."
        ]
      },
      {
        "scene_id": "scene_f984723e0c51",
        "slug": "why-we-re-here",
        "title": "Why We're Here",
        "kicker": "Civic Purpose",
        "display_lines": [
          "Build civic understanding.",
          "Protect fair process.",
          "Keep trust anchored in law."
        ],
        "speaker_notes": "Connect the session to public trust, fair process, and the legal profession's service role. Make clear that the aim is civic understanding, not partisan persuasion.",
        "duration_tags": [
          45,
          60
        ],
        "audience_mode": "public",
        "visual_treatment": "Editorial civic collage with courthouse geometry, desert light, and strong typographic hierarchy.",
        "speaker_only_blocks": [
          {
            "title": "Facilitation Cue",
            "body": "Where do you most rely on fair processes in your community?"
          },
          {
            "title": "Likely Audience Question",
            "body": "How does this principle apply in everyday civic life?"
          },
          {
            "title": "Transition",
            "body": "Let's talk about what happens when the Rule of Law weakens."
          }
        ],
        "resource_refs": [],
        "source_support": [
          "manual_e3c3011015eb",
          "manual_c96fb3b8851c"
        ],
        "generated_scaffolding": [
          "Scene framing and visual treatment were generated from manual and field guide content for web presentation use."
        ]
      },
      {
        "scene_id": "scene_62e05f0ae8d4",
        "slug": "what-is-the-rule-of-law",
        "title": "What Is the Rule of Law?",
        "kicker": "Plain-English Definition",
        "display_lines": [
          "Rules over arbitrary power.",
          "Fair process over favoritism.",
          "Rights protected through accountable institutions."
        ],
        "speaker_notes": "Give the plain-English definition first: the Rule of Law means power is exercised through known rules and fair institutions rather than arbitrary will. Then emphasize that it protects rights, governs power, and makes fairness reliable instead of discretionary.",
        "duration_tags": [
          20,
          45,
          60
        ],
        "audience_mode": "public",
        "visual_treatment": "Minimal legal iconography with a calm, bright content field and disciplined spacing.",
        "speaker_only_blocks": [
          {
            "title": "Facilitation Cue",
            "body": "What should it mean for no one to be above the law?"
          },
          {
            "title": "Likely Audience Question",
            "body": "Is the Rule of Law just any law that gets passed?"
          },
          {
            "title": "Transition",
            "body": "Now that we have a definition, let's look at the principles that make it real."
          }
        ],
        "resource_refs": [],
        "source_support": [
          "manual_f2e21168de99"
        ],
        "generated_scaffolding": [
          "Scene framing and visual treatment were generated from manual and field guide content for web presentation use."
        ]
      },
      {
        "scene_id": "scene_6d54a67328c1",
        "slug": "why-it-matters",
        "title": "Why It Matters",
        "kicker": "Shared Public Value",
        "display_lines": [
          "It protects liberty.",
          "It disciplines power.",
          "It keeps disagreement peaceful."
        ],
        "speaker_notes": "Translate the principle into everyday value: stable expectations, fair treatment, and a way to resolve disagreement without force or favoritism.",
        "duration_tags": [
          20,
          45,
          60
        ],
        "audience_mode": "public",
        "visual_treatment": "Panoramic civic composition with human scale, institutional lines, and warm atmospheric gradient.",
        "speaker_only_blocks": [
          {
            "title": "Facilitation Cue",
            "body": "Where do you most rely on fair processes in your community?"
          },
          {
            "title": "Likely Audience Question",
            "body": "How does this principle apply in everyday civic life?"
          },
          {
            "title": "Transition",
            "body": "Let's talk about what happens when the Rule of Law weakens."
          }
        ],
        "resource_refs": [],
        "source_support": [
          "manual_c96fb3b8851c"
        ],
        "generated_scaffolding": [
          "Scene framing and visual treatment were generated from manual and field guide content for web presentation use."
        ]
      },
      {
        "scene_id": "scene_80e7ca034d58",
        "slug": "accountability",
        "title": "Accountability",
        "kicker": "Core Principle One",
        "display_lines": [
          "No person or institution is above the law."
        ],
        "speaker_notes": "Land the first pillar clearly: everyone is subject to the law. Keep it memorable and grounded.",
        "duration_tags": [
          45,
          60
        ],
        "audience_mode": "public",
        "visual_treatment": "Principle chapter slide with oversized numeral, gold rule, and one dominant message.",
        "speaker_only_blocks": [],
        "resource_refs": [],
        "source_support": [
          "manual_ef650fe7f5bf"
        ],
        "generated_scaffolding": [
          "Scene framing and visual treatment were generated from manual and field guide content for web presentation use."
        ]
      },
      {
        "scene_id": "scene_a538c0d9f9b1",
        "slug": "just-law",
        "title": "Just Law",
        "kicker": "Core Principle Two",
        "display_lines": [
          "Laws should be clear, public, stable, and rights-protecting."
        ],
        "speaker_notes": "Stress clarity, visibility, stability, and rights protection. Avoid abstract legal jargon.",
        "duration_tags": [
          45,
          60
        ],
        "audience_mode": "public",
        "visual_treatment": "Principle chapter slide with editorial document texture and clear visual hierarchy.",
        "speaker_only_blocks": [
          {
            "title": "Facilitation Cue",
            "body": "What should it mean for no one to be above the law?"
          },
          {
            "title": "Likely Audience Question",
            "body": "Is the Rule of Law just any law that gets passed?"
          },
          {
            "title": "Transition",
            "body": "Now that we have a definition, let's look at the principles that make it real."
          }
        ],
        "resource_refs": [],
        "source_support": [
          "manual_ef650fe7f5bf"
        ],
        "generated_scaffolding": [
          "Scene framing and visual treatment were generated from manual and field guide content for web presentation use."
        ]
      },
      {
        "scene_id": "scene_49a8ba1ab125",
        "slug": "open-government",
        "title": "Open Government",
        "kicker": "Core Principle Three",
        "display_lines": [
          "Legal rules and processes should be transparent."
        ],
        "speaker_notes": "Connect transparency to public trust and accountability. Explain why visibility into process matters.",
        "duration_tags": [
          45,
          60
        ],
        "audience_mode": "public",
        "visual_treatment": "Principle chapter slide with openness motif, transparency overlays, and desert light.",
        "speaker_only_blocks": [
          {
            "title": "Facilitation Cue",
            "body": "What does fairness or predictability look like in your daily life?"
          },
          {
            "title": "Likely Audience Question",
            "body": "How does this principle apply in everyday civic life?"
          },
          {
            "title": "Transition",
            "body": "Let's start by defining the Rule of Law in plain English."
          }
        ],
        "resource_refs": [],
        "source_support": [
          "manual_ef650fe7f5bf"
        ],
        "generated_scaffolding": [